{
  "schema_version": 1,
  "id": "c41931",
  "type": "character",
  "name": "Asaumi Tatsuya",
  "original_name": "浅海 達弥",
  "language": "en",
  "source_language": "en",
  "source": "Department: General Affairs\nFirst Impressions: Easily Talked Too, Kind\n\nHe's responsible for training the protagonist in her new job at the company.\nHe's a kind older brother type that looks friendly at first glance but he seems to shy away from deeper connections like he's drawing a line somewhere. It seems there's a secret involved.\nHe actually graduated at the top of his class from a famous university and is very sharp.\nThe president realized that ability and offered to promote him away from general affairs, but he doesn't like to stand out so he refused.",
  "source_sha256": "3cd4f67f65abe271ba5cc3c5b02f59654e03aa1f3700972ee3aa7314b432bec1",
  "translation": "Department: General Affairs\nFirst Impressions: Easily Talked Too, Kind\n\nHe's responsible for training the protagonist in her new job at the company.\nHe's a kind older brother type that looks friendly at first glance but he seems to shy away from deeper connections like he's drawing a line somewhere. It seems there's a secret involved.\nHe actually graduated at the top of his class from a famous university and is very sharp.\nThe president realized that ability and offered to promote him away from general affairs, but he doesn't like to stand out so he refused.",
  "vndb_url": "https://vndb.org/c41931"
}
