{
  "schema_version": 1,
  "id": "v67304",
  "type": "visual_novel",
  "name": "The Devil's Judgment",
  "original_name": null,
  "language": "zh-Hans",
  "source_language": "en",
  "source": "According to the report, a young man was found collapsed in an alley near the main avenue. He was barely conscious as he muttered incoherent words no one could understand.\n\nThe police took him into custody, but when the paramedics examined him, they found that despite the blood coming from his mouth, there wasn't a single wound on his body. \n\n\nNow it's your turn to uncover the truth.\n\nQuestion the mysterious man, separate fact from deception, and decide whether you're facing a lost soul or something far more sinister.\n\n[From [url=https://honeybunny-of.itch.io/the-judgment]itch.io[/url]]",
  "source_sha256": "67c299d76ddb395067b543a029fa620f008e8e4d9dcc8e3b4674a41724a952e4",
  "translation": "报道称，一名年轻男子被发现倒在主干道附近的一条小巷里。他几乎失去了知觉，嘴里咕哝着一些没人能听懂的语无伦次的话。\n\n警方将他拘留，但医​​护人员对他进行检查时发现，尽管他嘴里有血，但他身上却没有任何伤口。\n\n\n现在轮到你揭开真相了。\n\n询问神秘人，区分事实与欺骗，并确定你面对的是迷失的灵魂还是更险恶的东西。\n\n[来自[url=https://honeybunny-of.itch.io/the-judgment]itch.io[/url]]",
  "vndb_url": "https://vndb.org/v67304"
}
