{
  "schema_version": 1,
  "id": "v42287",
  "type": "visual_novel",
  "name": "Neruvia",
  "original_name": null,
  "language": "en",
  "source_language": "en",
  "source": "Something sinister threatens your kingdom and the magical creatures in it. But will you, the Princess, be able to find the culprit and save Neruvia? \n\nNeruvia is a visual novel mystery romance, from the perspective of you, the princess, as you meet various characters and form close bonds with some in hopes of uncovering the culprit and bringing peace back to your kingdom.\n\n[From [url=https://wicked-lamb-games.itch.io/neruvia]Itch.io[/url]]",
  "source_sha256": "d2797780e06380ba77d04c5eea7811f0a33849ddc187ff52476a02150c631c4d",
  "translation": "Something sinister threatens your kingdom and the magical creatures in it. But will you, the Princess, be able to find the culprit and save Neruvia? \n\nNeruvia is a visual novel mystery romance, from the perspective of you, the princess, as you meet various characters and form close bonds with some in hopes of uncovering the culprit and bringing peace back to your kingdom.\n\n[From [url=https://wicked-lamb-games.itch.io/neruvia]Itch.io[/url]]",
  "vndb_url": "https://vndb.org/v42287"
}
