{
  "schema_version": 1,
  "id": "c65977",
  "type": "character",
  "name": "Ayume Suisen",
  "original_name": "あゆめスイセン",
  "language": "en",
  "source_language": "en",
  "source": "A beautiful woman who the protagonist meets in a local bar at night.\n\n[Translated from [url=https://enoshima210.work/2021/06/05/mfa/]the official website[/url]]",
  "source_sha256": "b237c6c3790e3947bbcc3e12462713f752a6378be2214a47b7ebd8a157cb8403",
  "translation": "A beautiful woman who the protagonist meets in a local bar at night.\n\n[Translated from [url=https://enoshima210.work/2021/06/05/mfa/]the official website[/url]]",
  "vndb_url": "https://vndb.org/c65977"
}
