{
  "schema_version": 1,
  "id": "v21323",
  "type": "visual_novel",
  "name": "Yuugekitai",
  "original_name": "遊撃隊",
  "language": "en",
  "source_language": "en",
  "source": "The story of adventures of a school boys band.\n\n[From [url=https://vndbreview.blogspot.com/2017/05/vn-of-year-1990.html]vndbreview[/url]]",
  "source_sha256": "486a4ca82958d49709841c6728292a4631f6a300cb1a00db58e37f49381c3e13",
  "translation": "The story of adventures of a school boys band.\n\n[From [url=https://vndbreview.blogspot.com/2017/05/vn-of-year-1990.html]vndbreview[/url]]",
  "vndb_url": "https://vndb.org/v21323"
}
