{
  "schema_version": 1,
  "id": "v55463",
  "type": "visual_novel",
  "name": "Chadpaca City",
  "original_name": null,
  "language": "zh-Hans",
  "source_language": "en",
  "source": "The Chads have left town and moved to a new city to find bitches without getting cockblocked.\n\nTonight's the night of their first party in the new city and there will be bitches there. Step inside and watch the Chads in action in this visual novel masterpiece.",
  "source_sha256": "6ee059ceacf1ce945c1ae1f72fb745e763b4d44a574077e27da4af583331e15d",
  "translation": "乍得一家人离开了小镇，搬到了一个新城市，寻找不会被鸡巴堵塞的母狗。\n\n今晚是他们在新城市第一次聚会的夜晚，那里会有母狗。走进这部视觉小说杰作，观看查德一家的行动。",
  "vndb_url": "https://vndb.org/v55463"
}
