{
  "schema_version": 1,
  "id": "v4626",
  "type": "visual_novel",
  "name": "Ano Ko no Shojo wa Ore no Mono -Renkinjutsu de Ano Ko no Shikyuu ni Seieki Chuunyuu♪-",
  "original_name": "あの娘の処女は俺のもの ―錬金術であの娘の子宮に精液注入♪―",
  "language": "en",
  "source_language": "en",
  "source": "Make use of the alchemy and science power, gain that pretty girl's virginity!\n\nCollect materials in the forest around the magical school.\nMake items from that materials with alchemy.\nBecome strong enough to attack 6 girls including a beast girl and an elf!\n\n[From [url=http://eng.dlsite.com/work/=/product_id/RE064484.html]DLsite English[/url]]",
  "source_sha256": "bbfeb44acfaa86011109b083881e54d0906a9289dd4e88a8982b31a472aff1b4",
  "translation": "Make use of the alchemy and science power, gain that pretty girl's virginity!\n\nCollect materials in the forest around the magical school.\nMake items from that materials with alchemy.\nBecome strong enough to attack 6 girls including a beast girl and an elf!\n\n[From [url=http://eng.dlsite.com/work/=/product_id/RE064484.html]DLsite English[/url]]",
  "vndb_url": "https://vndb.org/v4626"
}
