{
  "schema_version": 1,
  "id": "v31852",
  "type": "visual_novel",
  "name": "Sugar Daddies",
  "original_name": null,
  "language": "zh-Hans",
  "source_language": "en",
  "source": "It is the story of a group of young girls who are supported by sugar daddies. The story takes place on \"Auro Digger Island.\" \"Auro\" is the Samoan word for gold. You will play as the third party Master of Ceremonies, and make decisions for most of the characters in the game.\n\nThe central character is a girl named, \"Dawn.\" The player can edit this name to suit their own tastes. \"Dawn\"  has been lied to, and betrayed by everybody close to her. The player's decisions will directly influence the actions of the various potential Sugar Daddies, and how \"Dawn\" evolves.\n\n[From Patreon]",
  "source_sha256": "45ed109e9bf33a4cf3b4442e04b67b4a5db209ac808aafca774578071fba6e21",
  "translation": "这是关于一群年轻女孩在糖爹的支持下的故事。故事发生在“奥罗迪格岛”。“Auro”是萨摩亚语中黄金的意思。你将扮演第三方司仪，并为游戏中的大多数角色做出决定。\n\n主角是一位名叫“黎明”的女孩。玩家可以根据自己的喜好编辑此名称。“黎明”被所有与她亲近的人欺骗和背叛。玩家的决定将直接影响各种潜在糖爹的行动，以及“黎明”的演变。\n\n[来自帕特伦]",
  "vndb_url": "https://vndb.org/v31852"
}
