{
  "schema_version": 1,
  "id": "v44708",
  "type": "visual_novel",
  "name": "A Hint of Purple",
  "original_name": null,
  "language": "en",
  "source_language": "en",
  "source": "Argue with your Prefrontal Cortex, insult an art critic, befriend the elderly.\n\nA Hint of Purple is a short visual novel about queer love and art. Follow Maya, a once-celebrated painter now paralyzed, as she struggles to accept her new reality and its effects on her relationship.\n\n[From [url=https://dormin42.itch.io/a-hint-of-purple]Itch.io[/url]]",
  "source_sha256": "8107721db4be49cf4e53176b52d1b3ef2d0b9cff3a21aa7dbee06fcdff08d0ac",
  "translation": "Argue with your Prefrontal Cortex, insult an art critic, befriend the elderly.\n\nA Hint of Purple is a short visual novel about queer love and art. Follow Maya, a once-celebrated painter now paralyzed, as she struggles to accept her new reality and its effects on her relationship.\n\n[From [url=https://dormin42.itch.io/a-hint-of-purple]Itch.io[/url]]",
  "vndb_url": "https://vndb.org/v44708"
}
