{
  "schema_version": 1,
  "id": "v25269",
  "type": "visual_novel",
  "name": "DearlyDialy - Dearly Diary",
  "original_name": "DearlyDialy ディアリーダイアリー",
  "language": "zh-Hans",
  "source_language": "en",
  "source": "To repay a debt, a female private tutor earns money by doing her job, and \nperhaps selling herself in this text adventure game with some simulator elements.\n\n[From [url=http://www.dlsite.com/ecchi-eng/work/=/product_id/RE245028.html]DLsite English[/url]]",
  "source_sha256": "4d70c0a911bbecf9fe81e40ab087dc2c5205cb836e60f1df9b02c8832acdf2ca",
  "translation": "为了还债，女家庭教师靠打工赚钱，\n也许在这个带有一些模拟器元素的文本冒险游戏中推销自己。\n\n[来自[url=http://www.dlsite.com/ecchi-eng/work/=/product_id/RE245028.html]DLsite英文[/url]]",
  "vndb_url": "https://vndb.org/v25269"
}
