{
  "schema_version": 1,
  "id": "c20443",
  "type": "character",
  "name": "Komine Natsuko",
  "original_name": "小峯 夏子",
  "language": "en",
  "source_language": "en",
  "source": "“Big Sis!”—my cousin, the older sister I want to throw myself into her arms and rely on. She's cheerful, thoughtful, and deeply compassionate, valuing feelings over reason.\n\nShe runs a motorcycle delivery service for the village elders and is beloved by everyone. Her only flaw is occasionally pushing her own strong-willed, opinionated views—her “Gianism” (“What's yours is mine, and what's mine is mine”).\n\nAccording to Natsuko, she has a habit of clinging and insists it's just natural human affection, but she only does this to the protagonist, her beloved little brother figure.\n\nShe doesn't mean to seduce him, but her inherent lack of shame and guard in these matters makes her a complicated older sister with plenty of questionable behavior.\n\n[From [url=https://web.archive.org/web/20080415135100/http://www.lucha-game.com/product/oneboku/top_off.html]archived official site[/url]]",
  "source_sha256": "b5114e82dcacd0160da0cc2799846d4ef520c5f69d9a48f90cc14ce0874b6a89",
  "translation": "“Big Sis!”—my cousin, the older sister I want to throw myself into her arms and rely on. She's cheerful, thoughtful, and deeply compassionate, valuing feelings over reason.\n\nShe runs a motorcycle delivery service for the village elders and is beloved by everyone. Her only flaw is occasionally pushing her own strong-willed, opinionated views—her “Gianism” (“What's yours is mine, and what's mine is mine”).\n\nAccording to Natsuko, she has a habit of clinging and insists it's just natural human affection, but she only does this to the protagonist, her beloved little brother figure.\n\nShe doesn't mean to seduce him, but her inherent lack of shame and guard in these matters makes her a complicated older sister with plenty of questionable behavior.\n\n[From [url=https://web.archive.org/web/20080415135100/http://www.lucha-game.com/product/oneboku/top_off.html]archived official site[/url]]",
  "vndb_url": "https://vndb.org/c20443"
}
