{
  "schema_version": 1,
  "id": "v943",
  "type": "visual_novel",
  "name": "Sora no Iro, Mizu no Iro",
  "original_name": "そらのいろ、みずのいろ",
  "language": "zh-Hans",
  "source_language": "en",
  "source": "The protagonist, Saisho Hajime, finds himself stuck in remedial classes despite being on summer break. He shares this fate with Mizushima Asa, a somewhat aloof transfer student who is also on the swim team. Though Hajime tries to be friendly, Asa's responses are cold. Meanwhile, Unno Juuzou, another swim club member, notices Sorayama Natsume from the gardening club and falls for her at first sight.\n\nAs days pass, filled with remedial classes and casual swim practices, Natsume brings vegetables harvested from the garden and invites swim club members to share a meal, leading to her becoming closer to Hajime and Juuzou but remaining awkward with Asa.\n\nHoping to improve their relationship, Hajime and Juuzou organize a camping trip for the four of them. Asa and Natsume agree to go, but an incident occurs on the way back, marking the start of their hot summer story.\n\n[Translated from the [url=http://www.sp-janis.com/ciel/soranoiromizunoiro/]official site[/url]]",
  "source_sha256": "3fa43e8b1e5619fb7a55395e184ff052756fdb0423e6d4967d95015a7f740549",
  "translation": "主人公最所一因为暑假补习而无法尽情享受假期。与他同病相怜的，还有态度有些冷淡的转学生兼游泳部成员水岛朝。尽管最所一试图友好相处，朝的回应始终十分冷漠。与此同时，另一名游泳部成员海野十三注意到园艺部的空山菜摘，并对她一见钟情。\n\n补习与轻松的游泳训练一天天过去，菜摘把园艺部收获的蔬菜带来，邀请游泳部成员一同用餐。她因此与一和十三逐渐亲近，与朝相处时却依然有些尴尬。\n\n为了改善两人的关系，一和十三组织四人一起去露营。朝和菜摘同意参加，然而回程途中发生了一场意外，也拉开了他们火热夏日故事的序幕。\n\n[翻译自[url=http://www.sp-janis.com/ciel/soranoiromizunoiro/]官方网站[/url]]",
  "vndb_url": "https://vndb.org/v943"
}
