{
  "schema_version": 1,
  "id": "v6015",
  "type": "visual_novel",
  "name": "Mad Science Love",
  "original_name": "マッドサイエンス・ラヴ",
  "language": "zh-Hans",
  "source_language": "en",
  "source": "Who would like to spend days with \"normal\" girls if there is an option? All kinds of special girls like cat ears, drill, amphibian etc fight with each other and grow up under supervision of a mad scientist.\n\n[From [url=https://vndbreview.blogspot.com/2019/03/vn-of-month-august-2001-kimi-ga-nozomu.html]vndbreview[/url]]",
  "source_sha256": "10018a4d5d5bd4c2858f9681cf17a97e43a3105cae7b07375bf6a7f7b6326eb6",
  "translation": "既然还有别的选择，谁愿意整天和“普通”少女相处？猫耳少女、钻头少女、两栖少女等形形色色的特殊少女彼此争斗，并在一名疯狂科学家的监督下成长。\n\n[摘自[url=https://vndbreview.blogspot.com/2019/03/vn-of-month-august-2001-kimi-ga-nozomu.html]vndbreview[/url]]",
  "vndb_url": "https://vndb.org/v6015"
}
