{
  "schema_version": 1,
  "id": "v60848",
  "type": "visual_novel",
  "name": "Love On Track",
  "original_name": null,
  "language": "zh-Hans",
  "source_language": "en",
  "source": "Meet six students trying to make it through college in the heart of Manila. Balance exams, friendships, family ties, and the sparks of romance as you guide them through the highs and lows of young adulthood.\n\n[From [url=https://retellgames.itch.io/love-on-track]Itch.io[/url]]",
  "source_sha256": "efc78f2f6e77ee0934f53c52f133353b0332528cea8acecc61f26412445dbffa",
  "translation": "认识六名正在马尼拉市中心努力完成大学学业的学生。平衡考试、友谊、家庭关系和浪漫的火花，引导他们度过青年时期的高潮和低谷。\n\n[来自[url=https://retellgames.itch.io/love-on-track]Itch.io[/url]]",
  "vndb_url": "https://vndb.org/v60848"
}
