{
  "schema_version": 1,
  "id": "c76728",
  "type": "character",
  "name": "Yamabuki Kuon",
  "original_name": "山吹 久遠",
  "language": "en",
  "source_language": "en",
  "source": "Kuon is in her first year in high school and is Touki’s kouhai. A cute and lively underclassman, she honestly expresses what she feels. She loves and admires Ayumi, to the point where she follows her around at every opportunity that arises. Kuon is pretty silly and weird at times and happens to love cute things. During her free time, she helps out at her mother's café.",
  "source_sha256": "3d2f096d31929042ae04c22c12ecf7f0d3d21f939f83f65f604ad401475ee8e4",
  "translation": "Kuon is in her first year in high school and is Touki’s kouhai. A cute and lively underclassman, she honestly expresses what she feels. She loves and admires Ayumi, to the point where she follows her around at every opportunity that arises. Kuon is pretty silly and weird at times and happens to love cute things. During her free time, she helps out at her mother's café.",
  "vndb_url": "https://vndb.org/c76728"
}
