{
  "schema_version": 1,
  "id": "v50851",
  "type": "visual_novel",
  "name": "Yuehua Huiying zhi Ke",
  "original_name": "月华辉映之刻",
  "language": "en",
  "source_language": "en",
  "source": "This is the profound bond born from the gap between the two sides of Yin and Yang. The world only speaks of Kaifeng's prosperity and peacefulness, but it is difficult to see the hidden, dark underside. The beautified facade and the cruel truth. The thoughts of the living and the blessings of the dead. So, will you stop here, or investigate everything?",
  "source_sha256": "3185eac39c246c4b02bf8d6381ff8fbe52ea8ac5f27d5df89f2ee6e65973467c",
  "translation": "This is the profound bond born from the gap between the two sides of Yin and Yang. The world only speaks of Kaifeng's prosperity and peacefulness, but it is difficult to see the hidden, dark underside. The beautified facade and the cruel truth. The thoughts of the living and the blessings of the dead. So, will you stop here, or investigate everything?",
  "vndb_url": "https://vndb.org/v50851"
}
