{
  "schema_version": 1,
  "id": "c78616",
  "type": "character",
  "name": "Kwon Ga Eul",
  "original_name": "권가을",
  "language": "en",
  "source_language": "en",
  "source": "Pure spirit and trusts people. Even if he's tormented by people, he often doesn't know if it's tormenting or not, so the 'tormentor' quits doing so. He doesn't know the world, and doesn't know what to do for himself so he's often used a lot.",
  "source_sha256": "81c88a601dbc4e4e1105f398e2857cccd16e5730ae45ac46c279892c26ddf10c",
  "translation": "Pure spirit and trusts people. Even if he's tormented by people, he often doesn't know if it's tormenting or not, so the 'tormentor' quits doing so. He doesn't know the world, and doesn't know what to do for himself so he's often used a lot.",
  "vndb_url": "https://vndb.org/c78616"
}
