{
  "schema_version": 1,
  "id": "v22609",
  "type": "visual_novel",
  "name": "Shamrock no Hanakotoba",
  "original_name": "シャムロックの花言葉",
  "language": "en",
  "source_language": "en",
  "source": "Kouko heard an unbelievable rumour that her friend Nanaka was doing compensated dating and questioned her about it, but Nanaka brushed her off and run away. Worried about her friend, she started to search for her and ended up participating in the same activity as well. She hated it at first, but it was difficult to obtain information about this shady community unless she had first-hand experience. What she found inside was that Nanaka had become obsessed with the man who had also defiled her, and she decided to sell her own body to save her friend. It would be a negative cycle that would also entangle friends Matsuri and Aki…\n\n[From [url=https://omochikaeri.wordpress.com/2018/05/02/may-2018-eroge-releases/]Hau~ Omochikaeri~![/url]]",
  "source_sha256": "0316da176039d9067c06dd449f031900032be7f25ca044df4803cb7436cb82d2",
  "translation": "Kouko heard an unbelievable rumour that her friend Nanaka was doing compensated dating and questioned her about it, but Nanaka brushed her off and run away. Worried about her friend, she started to search for her and ended up participating in the same activity as well. She hated it at first, but it was difficult to obtain information about this shady community unless she had first-hand experience. What she found inside was that Nanaka had become obsessed with the man who had also defiled her, and she decided to sell her own body to save her friend. It would be a negative cycle that would also entangle friends Matsuri and Aki…\n\n[From [url=https://omochikaeri.wordpress.com/2018/05/02/may-2018-eroge-releases/]Hau~ Omochikaeri~![/url]]",
  "vndb_url": "https://vndb.org/v22609"
}
