{
  "schema_version": 1,
  "id": "c5014",
  "type": "character",
  "name": "Yumeshima Oboro",
  "original_name": "夢島 朧",
  "language": "en",
  "source_language": "en",
  "source": "Oboro is a first-year male student and is vice-president of Shokken. His parent manages a large confectionary company named Umachin. He tends to sexually harass Yuuki, much to his annoyance.\n\n[From [url=http://en.wikipedia.org/wiki/Koi_to_Senkyo_to_Chocolate]Wikipedia[/url]]",
  "source_sha256": "a8d36652623cd3278e241a112be50288d9d36a8637832a225703a6af683acf14",
  "translation": "Oboro is a first-year male student and is vice-president of Shokken. His parent manages a large confectionary company named Umachin. He tends to sexually harass Yuuki, much to his annoyance.\n\n[From [url=http://en.wikipedia.org/wiki/Koi_to_Senkyo_to_Chocolate]Wikipedia[/url]]",
  "vndb_url": "https://vndb.org/c5014"
}
